128,1,Sophomore,Yes,Political Science,,Male,1,,19,Caucasian/White,1,No,A few times a year,I am currently serving in the U.S. military,"My parents, grandparents and I were all born in the USA",,,ACT,,29,,No,,,,,,,NA,NA,,,NA,,NA,,NA,,NA,,NA,NA,NA,NA,NA,4,5,3,4,5,4,5,6,5,6,4,7,3,4,6,Neither agree nor disagree,Agree somewhat,Disagree somewhat,Disagree somewhat,Agree somewhat,Neither agree nor disagree,Neither agree nor disagree,Disagree somewhat,Agree strongly,Neither agree nor disagree,Neither like nor dislike,Like somewhat,Dislike somewhat,Dislike somewhat,Neither like nor dislike,Strongly Disagree,Strongly Disagree,Strongly Disagree,Strongly Disagree,Strongly Disagree,Strongly Agree,Strongly Agree,Strongly Agree,Neither Agree nor Disagree,Moderately Disagree,Strongly Agree,Moderately Agree,Slightly Agree,Strongly Agree,Slightly Agree,Almost never,Benefit of all,Some,,Quite a few,Some,0,100,45,0,77,29,49,13,9,Very Conservative,Strong Republican,Neither agree nor disagree,Neither agree nor disagree,Disagree strongly,Agree somewhat,Agree somewhat,Disagree somewhat,Agree,Uncertain,Uncertain,Disagree,Disagree,Disagree,Agree,Uncertain,Agree,Disagree,Disagree,Uncertain,Agree,Agree,Uncertain,Uncertain,Uncertain,Uncertain,Agree,Agree,Disagree,Disagree,Disagree,Disagree,Very Strongly,Strongly,Not strongly,Very Strongly,Very Strongly,Very Strongly,Very Strongly,Very Strongly,Very Strongly,Very Strongly,Very Strongly,Strongly,Very Strongly,Very Strongly,Not strongly,Not strongly,Not strongly,Not strongly,Very Strongly,Very Strongly,Very Strongly,Not strongly,Strongly,Strongly,Much easier,Extremely important,Increased a lot,Extremely important,Cover fewer Americans,Extremely important,Kept the same,Moderately important,Increased a lot,Extremely important,Allow same-sex marriage,Not at all important,Strongly favor,Extremely important,Trump won in the election,Chuck Schumer,Elizabeth Warren,Chris Christie,Speaker of the House,The Supreme Court,Democratic Party,Democratic Party,6 years,Two thirds of the House and Senate,France,Germany,Benjamin Netanyahu,France,Very closely,Very important,Other,4,1,1,3,5,0,Other,5,5,5,5,5,5,5,5,5,5,5,5,5,5,5,5,Some,Some,Some,Some,Some,Some,Some,Some,4,10,10,10,10,10,Very high,Very High (top 75%),5,4,Yes,1,No,0,No,0,Yes,1,2,Definitely have the knowledge and ability,Definitely have the knowledge and ability,Definitely have the knowledge and ability,Have much more knowledge and ability,Have much more knowledge and ability,Have much more knowledge and ability,4,4,6,6,7,Yes,Yes,,Yes,1,Yes,1,No,0,Yes,1,No,0,Yes,1,4,South/East Asia,0,4,Theresa May,10,1,Socialist Party USA,10,1,Each voter has the chance to rank the candidates in order of preference,10,1,Lower than 7.0%,10,1,Republican,10,1,China,10,1,University Chancellor,10,1,Executive Order,10,1,8,9 or 8
129,1,Freshman/First Year,Yes,"Humanities (e.g., English, History, Philosophy)",,Female,0,,18,Caucasian/White,1,Yes,Once or twice a month,"I previously served in the U.S. military but I am no longer active,Members of my immediate family have served in the U.S. military but are no longer active,Neither myself nor any members of my immediate family have ever served in the U.S. military",My parents and I were born in the USA but at least one of my grandparents was an immigrant,GPA:,3.94,ACT,,23,,No,,,,,,,NA,NA,,,NA,,NA,,NA,,NA,,NA,NA,NA,NA,NA,5,8,8,3,7,2,3,4,9,4,8,7,2,2,8,Neither agree nor disagree,Neither agree nor disagree,Neither agree nor disagree,Agree somewhat,Agree somewhat,Agree somewhat,Neither agree nor disagree,Neither agree nor disagree,Neither agree nor disagree,Agree somewhat,Like somewhat,Like somewhat,Neither like nor dislike,Like somewhat,Neither like nor dislike,Strongly Disagree,Strongly Disagree,Strongly Disagree,Strongly Disagree,Strongly Disagree,Slightly Disagree,Slightly Disagree,Neither Agree nor Disagree,Strongly Disagree,Neither Agree nor Disagree,Slightly Disagree,Slightly Disagree,Moderately Agree,Strongly Agree,Strongly Disagree,Only some of the time,Few big interests,Some,Don't know what they're doing,Quite a few,Not very much,100,0,52,100,28,52,52,51,53,Very Liberal,Democrat,Agree strongly,Neither agree nor disagree,Agree strongly,Disagree somewhat,Disagree strongly,Agree somewhat,Agree,Uncertain,Disagree,Agree,Uncertain,Agree,Uncertain,Uncertain,Uncertain,Agree,Uncertain,Agree,Uncertain,Uncertain,Disagree,Uncertain,Uncertain,Uncertain,Uncertain,Disagree,Uncertain,Uncertain,Disagree,Agree,Very Strongly,Not strongly,Not strongly,Very Strongly,Not strongly,Strongly,Not strongly,Not strongly,Not strongly,Not strongly,Strongly,Strongly,Not strongly,Not strongly,Not strongly,Not strongly,Not strongly,Not strongly,Not strongly,Not strongly,Not strongly,Not strongly,Not strongly,Very Strongly,Much more difficult,Extremely important,Decreased a little,Moderately important,Cover all Americans,Very important,Kept the same,Moderately important,Decreased a lot,Very important,Allow same-sex marriage,Very important,Neither favor nor oppose,Slightly important,Trump won in the election,Chuck Schumer,Elizabeth Warren,Chris Christie,Speaker of the House,Congress,Reform Party,Republican Party,2 years,Two thirds of the House and Senate,India,Argentina,Benjamin Netanyahu,Russia,Not much at all,Somewhat important,Social media websites,4,0,3,3,7,5,"A comedy/sitcom (like ABC's ""The Middle"" or CBS's ""The Big Bang Theory"")",9,6,7,NA,4,9,9,NA,7,8,7,6,7,7,8,7,Not very much,Some,Not very much,,,A lot,A lot,,10,12,3,3,4,3,High,High (top 50-75%),8,4,Yes,1,No,0,No,0,No,0,1,Probably do not have the knowledge and ability,Probably have the knowledge and ability,Probably have the knowledge and ability,Have somewhat less knowledge and ability,Have somewhat more knowledge and ability,Have somewhat more knowledge and ability,6,3,4,3,5,No,,,No,0,No,0,No,0,No,0,No,0,No,0,0,Mexico,1,1,Tony Blair,NA,0,Socialist Party USA,2,1,Each voter votes for parties instead of individual candidates,NA,0,Lower than 7.0%,NA,1,Republican,4,1,China,5,1,University Chancellor,2,1,Executive Order,NA,1,7,3 or 2
130,1,Sophomore,Yes,Political Science,,Female,0,,19,Hispanic or Latino,0,Yes,A few times a year,Neither myself nor any members of my immediate family have ever served in the U.S. military,I was born in the USA but at least one of my parents is an immigrant,,,,,NA,"$0-$24,999",Yes,Language 1 (Please specify),SPanish,,,,,NA,NA,Native or Bilingual,Native or Bilingual,NA,,NA,,NA,,NA,,NA,NA,NA,NA,NA,5,5,5,8,5,5,8,8,5,5,5,5,5,5,5,Disagree somewhat,Disagree somewhat,Disagree somewhat,Disagree somewhat,Disagree somewhat,Disagree somewhat,Disagree somewhat,Disagree somewhat,Disagree somewhat,Disagree somewhat,Like somewhat,Like somewhat,Like somewhat,Neither like nor dislike,Dislike somewhat,Neither Agree nor Disagree,Slightly Agree,Slightly Agree,Slightly Disagree,Slightly Agree,Slightly Agree,Slightly Agree,Slightly Agree,Slightly Agree,Slightly Agree,Slightly Agree,Neither Agree nor Disagree,Slightly Agree,Slightly Agree,Slightly Agree,Almost never,Few big interests,Some,Know what they're doing,Not many,Not very much,100,0,34,100,0,100,56,55,33,Liberal,Strong Democrat,Agree strongly,Agree strongly,Agree strongly,Agree strongly,Agree strongly,Agree strongly,Disagree,Disagree,Agree,Agree,Agree,Uncertain,Disagree,Disagree,Disagree,Disagree,Disagree,Agree,Disagree,Disagree,Disagree,Disagree,Uncertain,Disagree,Disagree,Disagree,Agree,Disagree,Uncertain,Uncertain,Very Strongly,Very Strongly,Very Strongly,Very Strongly,Very Strongly,Very Strongly,Very Strongly,Very Strongly,Very Strongly,Very Strongly,Very Strongly,Very Strongly,Very Strongly,Very Strongly,Very Strongly,Very Strongly,Very Strongly,Very Strongly,Very Strongly,Very Strongly,Very Strongly,Very Strongly,Very Strongly,Very Strongly,Somewhat more difficult,Moderately important,Decreased a little,Slightly important,Kept at current levels,Moderately important,Kept the same,Moderately important,Kept the same,Moderately important,Allow same-sex marriage,Extremely important,Strongly oppose,Extremely important,Had the highest sales tax rates,Joe Manchin,Barbara Boxer,Newt Gingrich,Speaker of the House,The Supreme Court,Republican Party,Democratic Party,4 years,Two thirds of the House and three quarters of the Senate,France,Germany,Benjamin Netanyahu,France,Fairly closely,Somewhat important,Radio,1,4,3,2,6,5,"A comedy/sitcom (like ABC's ""The Middle"" or CBS's ""The Big Bang Theory"")",3,7,7,3,9,9,7,8,7,7,7,7,7,7,7,7,,Not very much,Not very much,,Not very much,Not very much,Not very much,Not very much,6,4,6,8,8,7,High,High (top 50-75%),9,9,No,0,No,0,No,0,Yes,1,1,Definitely have the knowledge and ability,Definitely have the knowledge and ability,Definitely have the knowledge and ability,Have much more knowledge and ability,Have much more knowledge and ability,Have much more knowledge and ability,8,8,5,5,5,Yes,Yes,,Yes,1,Yes,1,Yes,1,Yes,1,Yes,1,Yes,1,6,Mexico,1,9,Tony Blair,7,0,Green Party,8,0,Each voter votes for parties instead of individual candidates,7,0,8.6 - 10.0%,6,0,Democrat,9,0,China,9,1,Vice Chancellor for Academic Affairs,4,0,Legislation,5,0,2,7 or 6
131,1,Freshman/First Year,Yes,Engineering,,Female,0,,19,Asian,0,No,Never,Neither myself nor any members of my immediate family have ever served in the U.S. military,I was born in the USA but at least one of my parents is an immigrant,GPA:,3.31,"SAT,ACT",1980,30,"$25,000-$49,999",Yes,"Language 1 (Please specify),Language 2 (Please specify)",Mandarin Chinese,Cantonese,,,,NA,NA,Native or Bilingual,Limited working proficiency,NA,Elementary proficiency,NA,,NA,,NA,,NA,NA,NA,NA,NA,6,2,5,1,4,7,4,5,5,3,8,5,5,9,7,Disagree somewhat,Agree somewhat,Agree somewhat,Neither agree nor disagree,Neither agree nor disagree,Agree somewhat,Disagree somewhat,Agree somewhat,Disagree somewhat,Agree somewhat,Like somewhat,Like somewhat,Dislike somewhat,Dislike somewhat,Dislike somewhat,Moderately Disagree,Neither Agree nor Disagree,Slightly Agree,Moderately Disagree,Moderately Agree,Moderately Disagree,Slightly Disagree,Slightly Agree,Moderately Disagree,Strongly Disagree,Slightly Agree,Moderately Disagree,Moderately Agree,Strongly Agree,Strongly Disagree,Most of the time,Few big interests,A lot,Know what they're doing,Not many,Some,85,0,75,65,15,25,33,52,40,Very Liberal,Strong Democrat,Agree strongly,Disagree strongly,Agree somewhat,Disagree strongly,Disagree strongly,Agree somewhat,Disagree,Disagree,Disagree,Agree,Agree,Agree,Disagree,Disagree,Disagree,Agree,Agree,Agree,Disagree,Disagree,Disagree,Agree,Agree,Agree,Agree,Disagree,Agree,Agree,Disagree,Agree,Not strongly,Very Strongly,Strongly,Very Strongly,Very Strongly,Not strongly,Strongly,Strongly,Strongly,Very Strongly,Very Strongly,Very Strongly,Strongly,Strongly,Not strongly,Not strongly,Strongly,Very Strongly,Strongly,Strongly,Strongly,Strongly,Very Strongly,Very Strongly,Much more difficult,Moderately important,Decreased a little,Slightly important,Cover all Americans,Very important,Increased a little,Slightly important,Decreased a lot,Moderately important,Allow same-sex marriage,Extremely important,Strongly oppose,Slightly important,Trump won in the election,Chuck Schumer,Elizabeth Warren,Chris Christie,Speaker of the House,The Supreme Court,Republican Party,Republican Party,6 years,Two thirds of the House and Senate,France,Germany,Benjamin Netanyahu,Russia,Fairly closely,Very important,Websites for news organizations,0,0,0,5,7,2,"A drama (like CBS's ""Scorpion"" or NBC's ""Law & Order: Special Victims Unit"")",1,1,1,9,1,9,1,1,1,3,3,9,2,9,3,1,,,,Some,,Some,,,11,3,7,8,6,7,High,High (top 50-75%),10,5,Yes,1,Yes,1,No,0,Yes,1,3,Probably have the knowledge and ability,Probably have the knowledge and ability,Probably do not have the knowledge and ability,Have somewhat more knowledge and ability,Have somewhat more knowledge and ability,Have somewhat less knowledge and ability,8,6,5,5,6,Yes,Yes,,Yes,1,Yes,1,No,0,Yes,1,No,0,Yes,1,4,Mexico,1,5,Theresa May,10,1,Socialist Party USA,10,1,Each voter has the chance to rank the candidates in order of preference,5,1,Lower than 7.0%,7,1,Republican,10,1,China,10,1,University Chancellor,10,1,Memorandum,4,0,8,9 or 8
132,1,Senior,Yes,I have more than one major,"Political Science,Humanities (e.g., English, History, Philosophy)",Male,1,,22,Caucasian/White,1,Yes,A few times a year,,"My parents, grandparents and I were all born in the USA",GPA:,3.4,ACT,,32,"$50,000-$74,999",Yes,Language 1 (Please specify),Portuguese,,,,,NA,NA,Native or Bilingual,Limited working proficiency,NA,,NA,,NA,,NA,,NA,NA,NA,NA,NA,6,6,3,2,6,4,1,6,2,2,5,8,9,4,7,Disagree somewhat,Disagree somewhat,Neither agree nor disagree,Neither agree nor disagree,Agree somewhat,Agree strongly,Disagree somewhat,Agree somewhat,Neither agree nor disagree,Neither agree nor disagree,Like somewhat,Neither like nor dislike,Neither like nor dislike,Dislike somewhat,Dislike somewhat,Strongly Disagree,Slightly Agree,Moderately Agree,Moderately Disagree,Moderately Agree,Strongly Disagree,Neither Agree nor Disagree,Slightly Disagree,Strongly Disagree,Moderately Disagree,Neither Agree nor Disagree,Moderately Disagree,Slightly Disagree,Strongly Agree,Strongly Disagree,Almost never,Few big interests,A lot,Don't know what they're doing,Quite a few,Not very much,62,2,6,38,2,2,23,24,36,Very Liberal,Independent Leaning Democrat,Agree strongly,Disagree strongly,Disagree strongly,Disagree strongly,Disagree strongly,Agree strongly,Disagree,Disagree,Disagree,Agree,Agree,Agree,Disagree,Disagree,Disagree,Agree,Agree,Agree,Disagree,Disagree,Disagree,Agree,Disagree,Agree,Uncertain,Disagree,Agree,Agree,Disagree,Agree,Strongly,Very Strongly,Very Strongly,Very Strongly,Not strongly,Strongly,Very Strongly,Very Strongly,Strongly,Very Strongly,Not strongly,Strongly,Very Strongly,Very Strongly,Very Strongly,Very Strongly,Very Strongly,Not strongly,Strongly,Very Strongly,Very Strongly,Not strongly,Very Strongly,Very Strongly,Somewhat more difficult,Moderately important,Decreased a little,Moderately important,Cover all Americans,Extremely important,Kept the same,Not at all important,Decreased a lot,Very important,Allow same-sex marriage,Extremely important,Strongly oppose,Moderately important,Trump won in the election,Chuck Schumer,Elizabeth Warren,Chris Christie,Speaker of the House,The Supreme Court,Republican Party,Republican Party,6 years,Three quarters of the House and two thirds of the Senate,France,Germany,Benjamin Netanyahu,Poland,Very closely,Very important,Websites for news organizations,1,0,0,5,7,1,"A drama (like CBS's ""Scorpion"" or NBC's ""Law & Order: Special Victims Unit"")",7,1,1,1,6,4,4,2,3,6,6,6,4,6,2,4,A lot,,,,A lot,,,,10,2,10,10,10,10,Very high,Very High (top 75%),10,10,Yes,1,Yes,1,Yes,1,Yes,1,4,Definitely have the knowledge and ability,Probably have the knowledge and ability,Probably have the knowledge and ability,Have much more knowledge and ability,Have much more knowledge and ability,Have much more knowledge and ability,8,6,7,9,8,Yes,Yes,,Yes,1,Yes,1,Yes,1,Yes,1,Yes,1,Yes,1,6,Other Latin America,0,7,Theresa May,10,1,Socialist Party USA,10,1,Each voter has the chance to rank the candidates in order of preference,10,1,Lower than 7.0%,3,1,Republican,10,1,China,8,1,University Chancellor,10,1,Executive Order,8,1,8,9 or 8
133,1,Junior,Yes,Political Science,,Male,1,,20,Asian,0,No,Never,Neither myself nor any members of my immediate family have ever served in the U.S. military,I was born in the USA but at least one of my parents is an immigrant,GPA:,3,SAT,2180,NA,,Yes,"Language 1 (Please specify),Language 2 (Please specify)",Chinese,French,,,,NA,NA,Native or Bilingual,Native or Bilingual,NA,Limited working proficiency,NA,,NA,,NA,,NA,NA,NA,NA,NA,8,4,7,9,10,6,3,7,8,2,7,8,2,5,6,Disagree somewhat,Disagree somewhat,Agree strongly,Agree somewhat,Disagree somewhat,Agree strongly,Disagree strongly,Agree strongly,Disagree somewhat,Agree strongly,Like somewhat,Dislike somewhat,Dislike somewhat,Dislike somewhat,Dislike strongly,Strongly Disagree,Strongly Disagree,Slightly Agree,Strongly Disagree,Strongly Agree,Strongly Disagree,Strongly Disagree,Neither Agree nor Disagree,Neither Agree nor Disagree,Strongly Disagree,Strongly Disagree,Strongly Disagree,Strongly Agree,Strongly Agree,Strongly Disagree,Only some of the time,Benefit of all,Some,Know what they're doing,Not many,Some,70,10,65,60,20,30,40,60,50,Liberal,Independent Leaning Democrat,Agree strongly,Disagree strongly,Agree strongly,Disagree strongly,Disagree somewhat,Agree strongly,Agree,Disagree,Disagree,Agree,Agree,Agree,Disagree,Disagree,Agree,Agree,Agree,Agree,Disagree,Disagree,Agree,Agree,Agree,Agree,Disagree,Disagree,Agree,Agree,Disagree,Agree,Strongly,Strongly,Very Strongly,Very Strongly,Very Strongly,Strongly,Strongly,Strongly,Strongly,Strongly,Strongly,Very Strongly,Very Strongly,Very Strongly,Very Strongly,Very Strongly,Strongly,Very Strongly,Very Strongly,Very Strongly,Very Strongly,Very Strongly,Very Strongly,Very Strongly,Much more difficult,Very important,Kept the same,Moderately important,Cover all Americans,Extremely important,Increased a little,Moderately important,Decreased a little,Very important,Allow same-sex marriage,Extremely important,Strongly oppose,Extremely important,Trump won in the election,Chuck Schumer,Elizabeth Warren,Chris Christie,Speaker of the House,The Supreme Court,Republican Party,Republican Party,6 years,Two thirds of the House and Senate,France,Germany,Benjamin Netanyahu,Russia,Very closely,Very important,Websites for news organizations,0,0,7,7,7,0,"Broadcast news (like the ""CBS Evening News"" or the ""NBC Nightly News"")",1,1,1,9,7,1,1,1,1,1,1,9,1,1,1,1,,,,A lot,Some,,,,9,1,9,9,9,8,Very high,High (top 50-75%),3,2,Yes,1,No,0,No,0,No,0,1,Probably have the knowledge and ability,Probably have the knowledge and ability,Probably have the knowledge and ability,Have somewhat more knowledge and ability,Have somewhat more knowledge and ability,Have somewhat more knowledge and ability,8,7,6,8,9,Yes,Yes,,Yes,1,Yes,1,No,0,No,0,No,0,Yes,1,3,Mexico,1,7,Theresa May,10,1,Socialist Party USA,9,1,Each voter has the chance to rank the candidates in order of preference,6,1,Lower than 7.0%,10,1,Republican,10,1,China,10,1,University Chancellor,6,1,Executive Order,10,1,9,7 or 6
134,1,Sophomore,Yes,Political Science,,Female,0,,19,Hispanic or Latino,0,No,Never,Neither myself nor any members of my immediate family have ever served in the U.S. military,I was born in the USA but at least one of my parents is an immigrant,GPA:,2.93,ACT,,23,"$75,000-$99,999",Yes,Language 1 (Please specify),Spanish,,,,,NA,NA,Native or Bilingual,Native or Bilingual,NA,,NA,,NA,,NA,,NA,NA,NA,NA,NA,5,8,4,10,10,6,1,5,9,7,9,7,7,6,5,Neither agree nor disagree,Agree strongly,Disagree somewhat,Agree somewhat,Agree somewhat,Agree strongly,Disagree strongly,Agree strongly,Disagree strongly,Agree somewhat,Like strongly,Like somewhat,Like somewhat,Like somewhat,Like somewhat,Strongly Disagree,Neither Agree nor Disagree,Strongly Disagree,Strongly Agree,Slightly Disagree,Moderately Agree,Strongly Disagree,Slightly Agree,Moderately Disagree,Neither Agree nor Disagree,Slightly Disagree,Slightly Disagree,Strongly Disagree,Strongly Agree,Moderately Disagree,Only some of the time,Few big interests,Some,Know what they're doing,Quite a few,Not very much,61,0,49,50,23,52,52,31,81,Somewhat left of center,Independent Leaning Democrat,Agree strongly,Disagree strongly,Agree strongly,Disagree strongly,Disagree somewhat,Agree somewhat,Agree,Disagree,Disagree,Agree,Uncertain,Agree,Uncertain,Uncertain,Uncertain,Uncertain,Agree,Agree,Disagree,Disagree,Disagree,Disagree,Disagree,Agree,Disagree,Disagree,Agree,Uncertain,Disagree,Agree,Strongly,Strongly,Not strongly,Very Strongly,Not strongly,Not strongly,Not strongly,Not strongly,Not strongly,Not strongly,Strongly,Strongly,Strongly,Strongly,Strongly,Not strongly,Not strongly,Not strongly,Very Strongly,Very Strongly,Very Strongly,Not strongly,Very Strongly,Very Strongly,Much more difficult,Moderately important,Decreased a lot,Extremely important,Cover more Americans,Moderately important,Increased a little,Slightly important,Kept the same,Not at all important,Allow same-sex marriage,Very important,Somewhat oppose,Slightly important,Trump won in the election,Chuck Schumer,Elizabeth Warren,Chris Christie,Speaker of the House,The Supreme Court,Republican Party,Democratic Party,2 years,Two thirds of the House and Senate,Brazil,Argentina,Benjamin Netanyahu,Russia,Not much at all,Very important,Social media websites,0,0,0,1,6,2,"Sports (like a game or show like ESPN's ""SportsCenter"")",7,8,8,8,8,9,2,2,8,5,8,5,8,8,2,2,A lot,Some,A lot,Some,Not very much,A lot,,,7,11,7,7,7,6,High,High (top 50-75%),8,8,Yes,1,No,0,No,0,No,0,1,Definitely have the knowledge and ability,Definitely have the knowledge and ability,Definitely have the knowledge and ability,Have much more knowledge and ability,Have somewhat more knowledge and ability,Have somewhat more knowledge and ability,5,5,3,5,8,Yes,No,,Yes,1,Yes,1,No,0,Yes,1,No,0,Yes,1,4,Mexico,1,5,Theresa May,2,1,Socialist Party USA,2,1,Each voter has the chance to rank the candidates in order of preference,2,1,7.0 - 8.5%,2,0,Republican,10,1,China,8,1,University Chancellor,10,1,Executive Order,6,1,8,5 or 4
135,1,Junior,Yes,Business,,Male,1,,22,Caucasian/White,1,No,Never,Members of my immediate family have served in the U.S. military but are no longer active,I am an immigrant to the USA and a naturalized citizen,GPA:,2.7,ACT,,34,"$25,000-$49,999",No,,,,,,,NA,NA,,,NA,,NA,,NA,,NA,,NA,NA,NA,NA,NA,6,4,7,1,8,7,6,3,5,4,7,8,2,5,10,Disagree strongly,Disagree strongly,Agree somewhat,Agree somewhat,Agree somewhat,Agree strongly,Disagree strongly,Agree strongly,Disagree strongly,Agree somewhat,Like strongly,Dislike somewhat,Like somewhat,Dislike somewhat,Dislike somewhat,Strongly Disagree,Strongly Disagree,Strongly Agree,Strongly Disagree,Strongly Agree,Strongly Disagree,Strongly Disagree,Strongly Agree,Strongly Disagree,Strongly Disagree,Moderately Agree,Strongly Disagree,Strongly Agree,Moderately Agree,Moderately Agree,Only some of the time,Few big interests,A lot,Know what they're doing,Not many,Some,93,0,36,28,11,13,12,9,9,Liberal,Democrat,Agree somewhat,Disagree somewhat,Disagree somewhat,Disagree somewhat,Agree somewhat,Agree somewhat,Disagree,Disagree,Disagree,Agree,Agree,Disagree,Disagree,Disagree,Agree,Agree,Agree,Agree,Disagree,Disagree,Disagree,Agree,Agree,Agree,Uncertain,Disagree,Agree,Agree,Disagree,Agree,Very Strongly,Strongly,Not strongly,Strongly,Not strongly,Not strongly,Not strongly,Not strongly,Not strongly,Strongly,Strongly,Strongly,Strongly,Not strongly,Not strongly,Strongly,Strongly,Strongly,Not strongly,Not strongly,Not strongly,Not strongly,Not strongly,Very Strongly,Much more difficult,Extremely important,Decreased a lot,Very important,Cover all Americans,Extremely important,Increased a little,Moderately important,Decreased a lot,Very important,Allow same-sex marriage,Slightly important,Neither favor nor oppose,Not at all important,Trump won in the election,Chuck Schumer,Claire McCaskill,Rush Limbaugh,Speaker of the House,The Supreme Court,Republican Party,Republican Party,2 years,Two thirds of the House and Senate,Japan,Germany,Ehud Olmert,Russia,Fairly closely,Very important,Social media websites,0,0,0,1,2,3,"Sports (like a game or show like ESPN's ""SportsCenter"")",9,1,1,1,9,1,1,1,9,4,4,4,9,6,1,1,Some,,,,A lot,,,,11,3,10,10,10,10,Very high,High (top 50-75%),10,10,Yes,1,Yes,1,No,0,No,0,2,Definitely have the knowledge and ability,Definitely have the knowledge and ability,Definitely have the knowledge and ability,Have much more knowledge and ability,Have much more knowledge and ability,Have much more knowledge and ability,10,10,10,10,10,Yes,No,,No,0,No,0,No,0,No,0,No,0,No,0,0,Mexico,1,10,Theresa May,10,1,Socialist Party USA,10,1,Each voter has the chance to rank the candidates in order of preference,10,1,Lower than 7.0%,10,1,Republican,10,1,Canada,10,0,University Chancellor,6,1,Legislation,10,0,7,7 or 6
